{
  "contract_version": 1,
  "project_identity": {
    "name": "agent-engineering-governance",
    "description": "Global portable agent engineering governance and bootstrap"
  },
  "remote": "https://github.com/FlapPearLabs/agent-engineering-governance.git",
  "default_branch": "main",
  "canonical_documents": {
    "targets": [
      "README.md"
    ],
    "specs": [
      "NONE"
    ],
    "architecture": [
      "RULES.md",
      "AGENTS.md",
      "audit/AUTHORITY_MAP_V2.md"
    ],
    "adrs": [
      "NONE"
    ],
    "spikes": [
      "NONE"
    ],
    "environment": [
      "deployment/PORTABLE_SETUP.md"
    ]
  },
  "execution_control_plane": {
    "type": "github-issues",
    "tracker_location": "FlapPearLabs/agent-engineering-governance"
  },
  "recovery_snapshot": {
    "last_verified_remote_sha": "c6e50aefd5c08bf88db24d25553673c251a0ba61",
    "last_state_flush_reason": "P1_T09_BOOTSTRAP_SURFACE_SCOPE_RECONCILED_AND_README_CONVERGED",
    "last_state_flush_at": "2026-09-20T03:09:54Z",
    "legal_frontier_summary": "P1 Stage 4 is COMPLETE and the P1-T09 bootstrap-surface scope gap it exposed has been RECONCILED. STAGE 4: three lanes were executed, independently reviewed and serially integrated into main by FAST-FORWARD only (5 commits, 0 merge commits) in the frozen order #23 -> #12 -> #22, with post-integration CI green on each exact integrated SHA. #23 P1-T11 CLOSED (completed); #22 P1-T10 CLOSED (completed). THE SCOPE GAP: #12 P1-T09 could not close because its CLOSURE_EVIDENCE item 1 requires a repository-wide search proving no residual character-budget semantics, and README.md (a bootstrap-facing canonical runtime doc per the validator's REQUIRED_FILES and runtime_files, and the surface whose section 7.4 IS the bootstrap three-piece set) still rendered the budget in characters at lines 487 and 540, while lying outside the spec's frozen four-surface change surface (MIG-07) and outside the ticket's WRITE_OWNERSHIP. The owner EXTENDED the approved REQ-W4-01 change surface to include README.md as the FIFTH bootstrap-facing convergence surface, and REJECTED the alternative of narrowing AC-17 condition 5 or MIG-07. AUTHORITY: that decision is durably recorded as Spec ROUND 6 (F-B1 plus same-root fixes R6-1/R6-2/R6-3) on branch spec/p1-agent-engineering-governance-delta at exact SHA c1b06cf94b8b5d13dc6955ea4f0b670a7545e9af (2 commits, 1 file, +167/-23; CI run 35482936917 SUCCESS), independently reviewed with AR1 = PASS and AR2 = PASS / L2 = PASS and no unresolved P0/P1. README target semantics are POINTER-ONLY: README may only point at deployment/BOOTSTRAP_CONTRACT.md section 2.1 and must not restate or declare the budget value, the unit, or the profile semantics, matching the already-implemented AGENTS.md section 10, because section 2.1 freezes the rule that other surfaces reference and do not restate. The ticket conformance was re-bound by a LIVE SCOPED TRACKER RECORD (#12 comment 5747036122) WITHOUT editing the ticket body, which stays byte-identical and still reproduces its recorded REVIEWED_BODY_SHA256 binding 89c0d1b63ff015f2e4d0154b95b8edadfce160a3deb7b57b331e69a300e3a2c7; the mechanism follows references/execution-stage.md line 109 (ticket content or related authority change means an impact-scoped re-check with the independent conclusion bound to the new version, never reusing the old whole-set PASS), references/ticket-lane.md line 177 (live state persists to the tracker) and line 15 (product write-back is limited to feature branch commits, lane evidence files, and tracker updates). THE REPAIR: README.md was corrected as c6e50aefd5c08bf88db24d25553673c251a0ba61 (README.md only, +2/-2) and integrated by fast-forward, with post-main CI run 35485545487 SUCCESS. All FIVE surfaces now converge: README.md, AGENTS.md section 10, deployment/BOOTSTRAP_CONTRACT.md, deployment/MEMORY_POINTER_CANDIDATE.md, and scripts/validate_governance.py. The current canonical and bootstrap-facing domain now contains ZERO residual character-budget semantics and ZERO instances of the forbidden framing where the budget is described as the observed truncation point minus a margin; the only surviving occurrences are three explicitly classified non-canonical classes, namely historical audit evidence under audit/, non-vacuity test fixtures in scripts/tests/test_p1_t09_*.py, and this state snapshot itself. #12 P1-T09 REMAINS OPEN: its README repair is complete, reviewed and integrated, and 11 of its 13 closure-evidence items are clean, but closure is WITHHELD because the adversarial L2 reviewer returned BLOCK on a reproduced fail-open-class enforcement gap. AC-17 condition 5 as amended explicitly names README.md and MIG-07 enumerates five surfaces, yet no gate checks README for budget wording, because scripts/tests/test_p1_t09_bootstrap_byte_budget.py line 251 sets IN_SCOPE to the three-tuple AGENTS, CONTRACT, CANDIDATE with no README entry and no README reference anywhere in the file. Reproducer executed by two independent reviewers and by the orchestrator: restoring the exact pre-fix wording at README.md line 487 and line 540 leaves BOTH the governance validator (31 of 31 checks passed) and the P1-T09 test module (22 tests) fully green. The minimal repair is a one-line IN_SCOPE widening in that test file; it lies OUTSIDE the surface authorized for this repair (the owner's instruction was to modify ONLY README.md) and outside the ticket's re-bound five-surface WRITE_OWNERSHIP, so it was deliberately NOT widened unilaterally and is routed to the owner. NEW FRONTIER: #24 P1-T08 is dependency-READY because its declared BLOCKED_BY tickets #21 and #23 are both CLOSED. #25 P1-T16 remains BLOCKED because its declared BLOCKED_BY is the pair #24 and #12, and #12 is still OPEN. Dependency-ready open tickets are #12 P1-T09 (content and README surface complete, closure withheld pending one owner decision), #13 P1-T13, #14 P1-T14, #15 P1-T15, #20 P1-T12, and #24 P1-T08. Frozen Stage-5 remains #24 P1-T08 -> #15 P1-T15 -> #20 P1-T12 and frozen Stage-6 remains #25 P1-T16 -> #13 P1-T13 -> #14 P1-T14. Stage 5 was NOT started. #9 remains OPEN as the parent tracker and is not a Stage ticket.",
    "blocker_refs": [
      "#12 P1-T09: closure is withheld on a reproduced fail-open-class enforcement gap, not on a content defect. AC-17 condition 5 (as amended by Spec ROUND 6) explicitly names README.md and MIG-07 enumerates five surfaces, but no gate checks README for budget wording: scripts/tests/test_p1_t09_bootstrap_byte_budget.py:251 sets IN_SCOPE = (AGENTS, CONTRACT, CANDIDATE) with no README entry. Reproducer: restoring the exact pre-fix wording at README.md:487 and :540 leaves both 'python3 scripts/validate_governance.py' (31/31) and the P1-T09 test module (22 tests) green. OWNER DECISION REQUIRED: authorize the one-line IN_SCOPE widening (add a README path constant and append it to IN_SCOPE), which is outside the authorized surface for this repair ('modify ONLY README.md') and outside the ticket's re-bound five-surface WRITE_OWNERSHIP."
    ],
    "next_legal_action": "OWNER_DECISION_ON_P1_T09_ENFORCEMENT_GAP_THEN_EXECUTE_STAGE_5"
  },
  "codegraph_policy": {
    "applicability": "REQUIRED",
    "lifecycle": "INIT_ONCE_SYNC_CONTINUOUSLY",
    "notes": "Governance includes executable validators; when CodeGraph unavailable use AGENTS Mode C enhanced manual grounding, not an applicability exemption."
  }
}
